,song_id,lyrics,title,artist,album,release,genre
0,3894276,오래 전에 함께 듣던 노래가 발걸음을 다시 멈춰서게 해 이 거리에서 너를 느낄 수 있어 널 이 곳에서 꼭 다시 만날 것 같아 너 일까봐 한번더 바라보고 너 일까봐 자꾸 돌아보게 돼 어디선가 같은 노래를 듣고 날 생각하며 너 역시 멈춰있을까 오래 전에 함께 듣던 노래가 거리에서 내게 우연히 들려온 것처럼  살아가다 한번쯤 우연히 만날 것 같아 사랑했던 그 모습 그대로 내 사랑이 그대로인 것처럼 발걸음이 여길  찾는 것처럼 꼭 만날꺼야 지금 이 노래처럼 날 사랑하는 네 맘도 같을테니까 오래 전에 함께 듣던 노래가 거리에서 내게 우연히 들려온 것처럼 살아가다 한번쯤 우연히 만날 것 같아 사랑했던 그 모습 그대로 운명처럼 아니면 우연처럼 우리가 다시 예전처럼 만날 수 있다면 너에게 나 해주고 싶은 말이 하나 있어 널 다시는 놓치지 않을게  오래 전에 함께 듣던 노래가 거리에서 내게 우연히 들려온 것처럼 살아가다 한번쯤 우연히 만날 것 같아 사랑했던 그 모습 그대로,오래된 노래,스탠딩 에그,오래된 노래,2012.09.04,"인디음악, 포크/블루스"
1,33346447,I thought that you remember but it seems that you forgot It’s hard for me to blame you when you were already lost oh yeah I’m tired of always waiting oh yeah yeah I see you changed your number That’s why you don’t get my calls I gave you all of me now you don’t want to be involved oh yeah yeah I really gotta face it oh yeah yeah  I just wanna be the one But to you we’re already done Tell me why’d you have to hit and run me Now I’m all alone crying ugly You broke my heart just for fun Took my love and just left me numb Now it’s 8 in the morning Hate in the morning All because of you  Another story that’s sad and true  I can feel the pain can you You had to be the one to let me down  To color me blue Hate to see you with someone new I’ll put a curse on her and you Ain’t no looking back now you’re dead and gone  My love is gone too  All my love is gone All my love is gone All my love is gone All my love is gone Now you’re dead and gone  All my love is gone and the hate has grown Standing all alone and I’m searching for something But I can’t feel nothin’ I pack my bags and go  This don’t feel like home Too much darkness for a rainbow I feel so used How am I supposed to live without you I refuse yeah  I just wanna be the one But to you we’re already done Tell me why’d you have to hit and run me Now I’m all alone crying ugly You broke my heart just for fun Took my love and just left me numb Now it’s 8 in the morning Hate in the morning All because of you  Another story that’s sad and true  I can feel the pain can you You had to be the one to let me down  To color me blue Hate to see you with someone new I’ll put a curse on her and you Ain’t no looking back now you’re dead and gone  My love is gone too  All my love is gone All my love is gone All my love is gone All my love is gone Now you’re dead and gone,Gone,로제 (ROSÉ),R,2021.03.12,포크/블루스
2,8124417,꽃이 언제 피는지  그딴 게 뭐가 중요한데 날씨가 언제 풀리는지  그딴 거 알면 뭐 할 건데 추울 땐 춥다고 붙어있고 더우면 덥다고 니네 진짜 이상해 너의 달콤한 남친은 사실 피씨방을 더  가고 싶어하지 겁나 피곤하대 봄이 그렇게도 좋냐 멍청이들아 벚꽃이 그렇게도 예쁘디 바보들아 결국 꽃잎은 떨어지지  니네도 떨어져라 몽땅 망해라 망해라 아무 문제 없는데  왜 나는 안 생기는 건데 날씨도 완전 풀렸는데  감기는 왜 또 걸리는데 추울 땐 추워서 안생기고 더우면 더워서 인생은 불공평해 너의 완벽한 연애는 아직 웃고 있지만 너도 차일거야 겁나 지독하게 봄이 그렇게도 좋냐 멍청이들아 벚꽃이 그렇게도 예쁘디 바보들아 결국 꽃잎은 떨어지지 니네도 떨어져라 몽땅 손 잡지 마 팔짱 끼지 마 끌어 안지 마 제발 아무것도 하지 좀 마 설레지 마 심쿵하지 마 행복하지 마 내 눈에 띄지 마 봄이 그렇게도 좋냐 멍청이들아 벚꽃이 그렇게도 예쁘디 바보들아 결국 꽃잎은 떨어지지 니네도 떨어져라 몽땅 망해라 망해라 망해라 망해라,봄이 좋냐??,10CM,3.2,2016.04.01,"인디음악, 포크/블루스"
3,31709523,안돼 그만둬 거기까지 해 더 다가가면 너 정신 못 차려 안돼 그만해 꽃은 넣어둬 그냥 좀 바람이 불게 놔줘 왜 그럴까 사람들은 그냥 봄기운이 좋아 눈치 없이 밖을 나가는 걸까 왜 이럴까 뭐가 설렌다고 봄바람이 좋아 내 맘도 모르고 더 불어와 flower sunshine 완벽한 하루를 사실 너와 걸을 수 있다면 얼마나 좋을까 좋아한다고 말하기가 무서워서 네 곁을 맴돌고 있는 난 벚꽃도 뭐고 다 필요 없어 나는 네 곁에 있고 싶어 딱 붙어서 봄이 지나갈 때까지 다른 사람 다 사라져라 나만 봄 왜 그럴까 사람들은 그냥 봄기운이 좋아 눈치 없이 밖을 나가는 걸까 왜 이럴까 뭐가 설렌다고 봄바람이 좋아 내 맘도 모르고 더 불어와 flower sunshine 완벽한 하루를 사실 너와 걸을 수 있다면 얼마나 좋을까 좋아한다고 말하기가 무서워서 네 곁을 맴돌고 있는 난 벚꽃도 뭐고 다 필요 없어 나는 네 곁에 있고 싶어 딱 붙어서 봄이 지나갈 때까지 다른 사람 다 사라져라 언제 봄이 왔는지 내 맘도 모르고 봄바람이 자꾸만 불어와 네 곁에 딱 붙어서 떨어지지 않고 싶어 내 맘을 이제 말하고 싶어 벚꽃도 뭐고 다 필요 없어 나는 네 곁에 있고 싶어 딱 붙어서 봄이 지나갈 때까지 다른 사람 다 사라져라 나만 봄,"나만, 봄",볼빨간사춘기,사춘기집Ⅰ 꽃기운,2019.04.02,"인디음악, 포크/블루스"
4,30611680,이건 세상에서 제일 비싼 단독 공연 가수는 나고 관객은 너 하나 화려한 막이 이제 곧 올라가기 전에 그저 몇 가지만 주의해줘요 세상에서 제일 편한 옷을 갈아 입고 제일 좋아하는 자리에 누워 배터리가 바닥나지 않게 조심하고 통화상태를 항상 유지해줘요 듣고 싶은 노래를 말 만해 everything 입이 심심할 때는 coffee popcorn anything 너무 부담주진 말고 편하게 들어줘 아님 내가 너무 떨리니까 오직 너에게만 감동적인 노래 오직 너를 웃게 하기 위한 코너 네가 너무 설레 잠 못 들게 만들 거야 지금이야 크게 소리 질러줘 누구보다 특별한 너의 취향을 알아 달콤한데 슬픈 듯 아찔하게 맞지 근데 다음 곡이 중요해 볼륨 높여봐 기억 나니 우리 그 날 그 노래 내가 너무 진지해 보여도 웃지마 누가 봐도 완벽한 노래는 아니지만 많이 연습한 부분을 너 때문에 틀리잖아 아직 나는 너무 떨리니까 오직 너에게만 감동적인 노래 오직 너를 웃게 하기 위한 코너 네가 너무 설레 잠 못 들게 만들 거야 지금이야 크게 소리 질러 이 공연은 거의 다 끝나 가고 있어 어땠는지 말해줘 문자로 너무나 아쉽지만 졸린 거 이미 알고 있어 기대해줘 마지막 곡 이 중에서도 제일 감동적인 노래 오직 너를 웃게 하기 위한 코너 네가 너무 설레 잠 못 들게 만들 거야 지금이야 제일 원하는 걸 말해 어떤 노래를 다시 듣고 싶어 사실 내가 원해 네가 너무 설레 잠 못 들지 모르지만 앵콜이야 크게 소리 질러줘 이건 세상에서 제일 비싼 단독공연 가수는 나고 관객은 너 하나,폰서트,10CM,4.0,2017.09.01,"인디음악, 포크/블루스"
5,5700639,툭 웃음이 터지면 그건 너 쿵 내려앉으면은 그건 너 축 머금고 있다면 그건 너 둥 울림이 생긴다면 그건 너 그대를 보며 나는 더운 숨을 쉬어요 아픈 기분이 드는 건 그 때문이겠죠 나를 알아주지 않으셔도 돼요 찾아오지 않으셔도 다만 꺼지지 않는 작은 불빛이 여기 반짝 살아있어요 영영 살아있어요 눈을 떼지 못 해 하루종일 눈이 시려요 슬픈 기분이 드는 건 그 때문이겠죠 제게 대답하지 않으셔도 돼요 달래주지 않으셔도 다만 꺼지지 않는 작은 불빛이 여기 반짝 살아있어요 세상 모든 게 죽고 새로 태어나 다시 늙어갈 때에도 감히 이 마음만은 주름도 없이 여기 반짝 살아있어요 영영 살아있어요 영영 살아있어요,마음,아이유,마음,2015.05.18,포크/블루스
6,32583036,나를 보면 숨어요 어디든 자유롭게 날아요 이 날씨도 그댈 위한 거예요 난 너를 찾아요 그러면 그댄 어디든 있어요 내 손 위에 머물러 잠시 앉아 쉬어요 몰래몰래 그대를 보아요 사랑스런 날개 그댄 어디서 온 건가요 말하지 못한 채 나 손을 뻗어요 보랏빛 날개 그대는 달아요 내 맘이 그런 것처럼 그대 맘이 그런 것처럼 yeah 나를 보면 숨어요 어디든 자유롭게 날아요 이 날씨도 그댈 위한 거예요 난 너를 찾아요 그러면 그댄 어디든 있어요 내 손 위에 머물러 잠시 앉아 쉬어요 가만히 난 몰래몰래 그대를 보아요 사랑스런 날개 그댄 어디서 온 건가요 말하지 못한 채 나 손을 뻗어요 보랏빛 날개 그대는 달아요 내 맘이 그런 것처럼 그대 맘이 그런 것처럼 yeah 나를 보면 숨어요 어디든 자유롭게 날아요 이 날씨도 그댈 위한 거예요 난 너를 찾아요 그러면 그댄 어디든 있어요 내 손 위에 머물러 잠시 앉아 쉬어요 설렘이 가득하죠 이 날씨도 그 기분까지도 난 너를 찾아요 그러면 그댄 어디든 있어요 내 손 위에 머물러 잠시 앉아 쉬어요 내 어깨에 기대어 잠시 눈을 감아요,나비와 고양이 (feat.백현 (BAEKHYUN)),볼빨간사춘기,사춘기집Ⅱ 꽃 본 나비,2020.05.07,"인디음악, 포크/블루스"
7,30657311,나는 한때 내가 이 세상에 사라지길 바랬어 온 세상이 너무나 캄캄해 매일 밤을 울던 날 차라리 내가 사라지면 마음이 편할까 모두가 날 바라보는 시선이 너무나 두려워 아름답게 아름답던 그 시절을 난 아파서 사랑 받을 수 없었던 내가 너무나 싫어서 엄마는 아빠는 다 나만 바라보는데 내 마음은 그런 게 아닌데 자꾸만 멀어만 가 어떡해 어떡해 어떡해 어떡해 시간이 약이라는 말이 내게 정말 맞더라고 하루가 지나면 지날수록 더 나아지더라고 근데 가끔은 너무 행복하면 또 아파올까 봐 내가 가진 이 행복들을 누군가가 가져갈까 봐 아름다운 아름답던 그 기억이 난 아파서 아픈 만큼 아파해도 사라지지를 않아서 친구들은 사람들은 다 나만 바라보는데 내 모습은 그런 게 아닌데 자꾸만 멀어만 가 그래도 난 어쩌면 내가 이 세상에 밝은 빛이라도 될까 봐 어쩌면 그 모든 아픔을 내딛고서라도 짧게 빛을 내볼까 봐 포기할 수가 없어 하루도 맘 편히 잠들 수가 없던 내가 이렇게라도 일어서 보려고 하면 내가 날 찾아줄까 봐 아아아아아아아 아아아아아아아 아아아아아아아 아아아아아아아 얼마나 얼마나 아팠을까 얼마나 얼마나 아팠을까 얼마나 얼마나 얼마나 바랬을까,나의 사춘기에게,볼빨간사춘기,Red Diary Page.1,2017.09.28,"인디음악, 포크/블루스"
8,5466962,나도 알아 나의 문제가 무엇인지 난 못났고 별 볼 일 없지 그 애가 나를 부끄러워 한다는 게 슬프지만 내가 뭐라고 빛나는 누군갈 좋아하는 일에  기준이 있는 거라면 이해할 수 없지만 할 말 없는걸 난 안경 쓴 샌님이니까 내가 이렇게 사랑하는데 이렇게 원하는데 나는 아무것도 할 수 없고 바라만 보는데도 내가 그렇게 불편할까요 내가 나쁜 걸까요 아마도 내일도 그 애는 뒷모습만 이제 알아 나의 할 일이 무엇인지 다 포기하고 참아야 하지 저 잘 나가는 너의 남자친구처럼 되고 싶지만 불가능하지 빛나는 누군갈 좋아하는 일에 기준이 있는 거라면 이해할 수 없지만 할 말 없는걸 난 안경 쓴 샌님이니까 내가 이렇게 사랑하는데 이렇게 원하는데 나는 아무것도 할 수 없고 바라만 보는데도 내가 그렇게 불편할까요 내가 나쁜 걸까요 아마도 내일도 그 애는 나는 왜 이런 사람 이런 모습이고 이런 사랑을 하고 나는 아무것도 될 수 없고 바라만 보는데도 내가 그렇게 불편하니까 내가 나쁜 거니까 아마도 내일도 그 애는 나도 알아 나의 문제가 무엇인지,스토커,10CM,3.0,2014.11.19,"인디음악, 포크/블루스"
9,30163110,안녕 오늘도 같은 자리 버스 창가에 기대 앉은 네게 인사를 해 Hi 역시 넌 받아 주지를 않네 인기 많고 잘생긴 넌 내게만 그렇게 쌀쌀하게 굴더라 근데 Last Night 기억나 넌 내가 좋다고 했어 그 예쁜 가로등 아래서 넌 내가 좋다고 말했어 다음부턴 모른 척 아닌 척해도 You Have To Know That 확신을 해야 돼 넌 그날 넌 내가 좋다고 했어 Yeah If You Like Me Or Love Me Just Say Yes Yes Yes And Then I'm Your Girlfriend And You're My Boyfriend 어서 내게 좋다고 말해 줘 몰래 오늘도 도서관 맨 앞자리에 기대 앉은 네게 인사를 해 Oh Boy 역시 넌 받아 주지를 않네 인기 많고 잘생긴 넌 내게만 그렇게 쌀쌀하게 굴더라 근데 Last Night 기억나 넌 내가 좋다고 했어 그 예쁜 가로등 아래서 넌 내가 좋다고 말했어 다음부턴 모른 척 아닌 척해도 You Have To Know That 확신을 해야 돼 넌 그날 넌 내가 좋다고 했어 Yeah If You Like Me Or Love Me Just Say Yes Yes Yes And Then I'm Your Girlfriend And You're My Boyfriend 어서 내게 좋다고 말해 줘 Oh 널 참 많이 좋아하는 난데 우린 이어질 수 없는 걸까 내 긴 교복 치마가 부끄러워 초라해 Yeah 네 곁엔 항상 키 크고 예쁜 애들이 넘치는데 Woo If You Like Me If You Love Me Yeah And Then I'm Your Girlfriend And You're My Boyfriend 어서 내게 좋다고 말해 줘 If You Like Me Or Love Me Just Say Yes Yes Yes And Then I'm Your Girlfriend And You're My Boyfriend 어서 내게 좋다고 말해 줘,좋다고 말해,볼빨간사춘기,Full Album RED PLANET 'Hidden Track',2016.12.21,"인디음악, 포크/블루스"
10,9620469,커피를 너무 많이 마셨나 봐요  심장이 막 두근대고  잠은 잘 수가 없어요  한참 뒤에 별빛이 내리면  난 다시 잠들 순 없겠죠  지나간 새벽을 다 새면  다시 네 곁에 잠들겠죠  너의 품에 잠든 난 마치  천사가 된 것만 같아요  난 그대 품에  별빛을 쏟아 내리고  은하수를 만들어  어디든 날아가게 할거야  Cause I’m a pilot anywhere  Cause I’m a pilot anywhere   lighting star shooting star  줄게 내 Galaxy  Cause I’m a pilot anywhere  Cause I’m your pilot 네 곁에   저 별을 따 네게만  줄게 my Galaxy Like a star 내리는 비처럼  반짝이는 널 가지고 싶어  Get ma mind  엄지와 검지만 해도  내 마음을 너무 잘 표현해  붙어 안달 나니까  마냥 떨리기만 한 게 아냐  준비가 되면 쏘아 올린  인공위성처럼  네 주윌 마구 맴돌려 해  더 가까워진다면  네가 가져줄래  이 떨림을  어제는 내가 기분이 참 좋아서  지나간 행성에다가  그대 이름 새겨 놓았죠  한참 뒤에 별빛이 내리면  그 별이 가장 밝게 빛나요  지나간 새벽을 다 새면  다시 네 곁에 잠들겠죠  별빛 아래 잠든 난 마치  온 우주를 가진 것만 같아  난 그대 품에  별빛을 쏟아 내리고  은하수를 만들어  어디든 날아가게 할거야  Cause I’m a pilot anywhere  Cause I’m a pilot anywhere   Lighting star Shooting star  줄게 내 Galaxy  Cause I’m a pilot anywhere  Cause I’m your pilot 네 곁에   저 별을 따 네게만  줄게 my Galaxy  Cause I’m a pilot anywhere   Cause I’m a pilot anywhere   Lighting star Shooting star  줄게 내 Galaxy  Cause I’m a pilot I’m your pilot  Lighting star Shooting star  줄게 my Galaxy  la la la la la la la la la la la la,우주를 줄게,볼빨간사춘기,Full Album RED PLANET,2016.08.29,"인디음악, 포크/블루스"
11,30657307,표현이 서툰 것도 잘못인가요  나 차가운 도시에 따뜻한 여잔데 그냥 좋아한단 말도 안 되는가요  솔직하게 난 말하고 싶어요 사라져 아니 사라지지 마  네 맘을 보여줘 아니 보여주지 마 하루 종일 머릿속에 네 미소만  우리 그냥 한번 만나볼래요 나 오늘부터 너랑 썸을 한번 타볼 거야  나 매일매일 네게 전화도 할 거야 밀가루 못 먹는 나를 달래서라도  너랑 맛있는 걸 먹으러 다닐 거야 넘넘 스윗한 넌 정말 달콤한 걸 넘넘 스윗한 넌 그냥 좋아한단 말도 안 되는가요  솔직하게 난 말하고 싶어요 사라져 아니 사라지지 마  네 맘을 보여줘 아니 보여주지 마 하루 종일 머릿속에 네 미소만  우리 그냥 한번 만나볼래요 나 오늘부터 너랑 썸을 한번 타볼 거야  나 매일매일 네게 전화도 할 거야 밀가루 못 먹는 나를 달래서라도  너랑 맛있는 걸 먹으러 다닐 거야 사랑은 이렇게 생기는 게 아니겠어  어쩌면 내 맘의 반쪽을  네게 걸어보는 건데 나는 오늘도 네게 차일 것만 같아도  난 한번 더 너에게 다시 달려가 볼 거야 나 오늘부터 너랑 썸을 한번 타볼 거야  나 매일매일 네게 전화도 할 거야 매운 거 못 먹는 나를 달래서라도  너랑 맛있는 걸 먹으러 다닐 거야 나도 그 애처럼 좋아요 좀 눌러줘  나도 너랑 말 좀 할 수 있게 해줘 나는 풀이 죽어서 오늘도 포기하고  뒤를 돌아볼 때쯤 나를 붙잡는 넌 넘넘 스윗한 넌 정말 달콤한 걸 넘넘 스윗한 넌,썸 탈꺼야,볼빨간사춘기,Red Diary Page.1,2017.09.28,"인디음악, 포크/블루스"
12,4583482,uh 나를봐 나를봐 나를봐  날 바라봐 바라봐 바라봐  너를 본 내 마음속에 사랑이  내 본능이 고백 빨리 하라 해  네 주위를 둘러싼 수많은 경쟁자  Yes I'm a soldier for you  sweet멘트 장전  발사하기 전에 제군들  입 풀었나 yes 완전  간장콩장콩장장 equals   간 콩장장  Yeah I'm ready  아침이 깨는 소리 Morning   바람들은  makes harmony  저물어가는 달빛은  let it go uh  여물어가는 romance   꿈꾸고 good night  Hey baby it's comin' new day  새로운 느낌이야 이건  Hey 왜 이래  It's common lovesick  아무래도 이거는 이거는  It must be L O V E 200 percent  sure of that  I want you really I mean really 정말이야 널 좋아하는데  빨갛게 익은   내 얼굴이 그걸 증명해  나를 봐 나를 봐 나를 봐  날 바라봐 바라봐 바라봐   난 strawberry처럼   very very  상큼한 사람   don't worry worry  어리바리한 그대   주위 사람들은 모두 다 이기주의  밤낮을 걸으며 널 지켜줄  나와 달리 그들은   차 키를 과시하지만   BAD GUY  자다가 일어나 잠꼬대로도 널 찾네   아침이 깨는 소리 Morning  바람들은  makes harmony  저물어가는 달빛은   let it go   여물어가는  romance 꿈꾸고  Hello 어디 가는 거니   where you  I'll be there  네가 있는 그 거리   that way  아직 우리 사이 서먹해도  그래도 try는 해봐야지 나라도  It must be L O V E 200 percent  sure of that  I want you really I mean really 정말이야 널 좋아하는데  빨갛게 익은 내 얼굴이 그걸 증명해  처음이야 이런 기분  멈추질 못하겠어 막 넘쳐  누가 잠가놓은 듯 내 입은  네 앞에서 오물쪼물 안 열려  내 부름에 뒤를 돌아보는   네 두 눈을 보니  I said see you tomorrow  Oh baby it can't be over like this  someone help me   내 맘을 전할 수 있다면  사실은 나 널 oh please  좋아하는데 I'm sure  모든 걸 담은 이 눈빛이 그걸 증명해  It must be L O V E 200 percent  sure of that  I want you really I mean really 정말이야 널 좋아하는데  빨갛게 익은 내 얼굴이 그걸 증명해  It must be L O V E,200%,AKMU (악동뮤지션),PLAY,2014.04.07,포크/블루스
13,30636089,이른 아침 작은 새들 노랫소리 들려오면  언제나 그랬듯 아쉽게 잠을 깬다  창문 하나 햇살 가득 눈부시게 비쳐오고  서늘한 냉기에 재채기할까 말까 음 눈 비비며 빼꼼히 창밖을 내다보니  삼삼오오 아이들은 재잘대며 학교 가고  산책 갔다 오시는 아버지의 양손에는  효과를 알 수 없는 약수가 하나 가득 음 딸각딸각 아침 짓는 어머니의 분주함과  엉금엉금 냉수 찾는 그 아들의 게으름이  상큼하고 깨끗한 아침의 향기와  구수하게 밥 뜸드는 냄새가 어우러진  가을 아침 내겐 정말 커다란 기쁨이야  가을 아침 내겐 정말 커다란 행복이야  응석만 부렸던 내겐  파란 하늘 바라보며 커다란 숨을 쉬니  드높은 하늘처럼 내 마음 편해지네 텅 빈 하늘 언제 왔나 고추잠자리 하나가 잠 덜 깬 듯 엉성히 돌기만 비잉비잉 음 토닥토닥 빨래하는 어머니의 분주함과 동기동기 기타 치는 그 아들의 한가함이 심심하면 쳐대는 괘종시계 종소리와 시끄러운 조카들의 울음소리 어우러진 가을 아침 내겐 정말 커다란 기쁨이야 가을 아침 내겐 정말 커다란 행복이야 응석만 부렸던 내겐 가을 아침 내겐 정말 커다란 기쁨이야 가을 아침 내겐 정말 커다란 행복이야 뜬구름 쫓았던 내겐 이른 아침 작은 새들 노랫소리 들려오면 언제나 그랬듯 아쉽게 잠을 깬다 창문 하나 햇살 가득 눈부시게 비쳐오고 서늘한 냉기에 재채기할까 말까 음,가을 아침,아이유,꽃갈피 둘,2017.09.22,포크/블루스
14,30181278,별 하나 있고 너 하나 있는 그곳이 내 오랜 밤이었어 사랑해란 말이 머뭇거리어도 거짓은 없었어 넌 화나 있고 참 조용했던 그곳이 내 오랜 밤이었어 어둠 속에서도 잠 이루지 못해 흐느껴오는 너의 목소리 그대 곁이면 그저 곁에서만 있어도 행복했단 걸 그 사실까지 나쁘게 추억 말아요 오랜 날 오랜 밤 동안 정말 사랑했어요 어쩔 수 없었다는 건 말도 안 될 거라 생각하겠지만 밉게 날 기억하지는 말아줄래요 아직도 잘 모르겠어 당신의 흔적이 지울 수 없이 소중해 잘 자요 안녕 그 말 끝으로 흐른 시간은 오랜 날 같았어 우린 서로에게 깊어져 있었고 난 그게 두려워 넌 가만있고 나도 그러했던 순간은 우리 오랜 날  함께한 시간을 아무런 의미도 없듯이 추억만 하게 하겠죠 그대 곁이면 그저 곁에서만 있어도 보고 싶고 또 행복했어 그건 진심이었소 오랜 날 오랜 밤 동안 정말 사랑했어요 어쩔 수 없었다는 건 말도 안 될 거라 생각하겠지만 밉게 날 기억하지는 말아줄래요 아직도 잘 모르겠어 당신의 흔적이 지울 수 없이 소중해 하늘이 참 뿌옇고 맘을 다잡아야 하죠 이젠 마지막 목소리 마지막 안녕 밉게 날 기억하지는 말아줄래요 아직도 잘 모르겠어 당신의 흔적이 지울 수 없이  소중해,오랜 날 오랜 밤,AKMU (악동뮤지션),사춘기 하 (思春記 下),2017.01.03,포크/블루스
15,31709524,maybe it's like a dream I see the stars over me maybe it's like a magic I know you you you're my star saturday night 재미없는 얘기 no beer no cheers 우리 둘만 여기 재미없는 사람끼리 눈이 맞았나 봐 you've heard of my songs 어떤 별을 가장 좋아하냐며 미소를 띠고 내게 말해 별 보러 갈래 listen to our favorite songs 좋아하는 노랠 듣고 웃고 떠들다 보면 we drive away 어느새 멋진 바다 위로 별들이 쏟아져내려 can’t you see the stars they called it milky way 쏟아져 머리 위로 넌 나를 업고 모래사장을 뛰어다녀 yeah 그중 가장 예쁜 저 별을 찾아서 밤이 새도록 뛰어다니고 stars are over me maybe I know the name I see the stars over me maybe you got a planet I know you you got my star everyday night 매일 같은 얘기 no feeling no chilling 우리 둘만 여기 재미없는 사람끼리 눈이 맞았나 봐 you've heard of my songs 어떤 별을 가장 좋아하냐며 미소를 띠고 내게 말해 별 보러 갈래 listen to our favorite songs 좋아하는 노랠 듣고 웃고 떠들다 보면 we drive away 어느새 멋진 바다 위로 별들이 쏟아져내려 can’t you see the stars 모래 위에 누워서 저 별을 다 세보다가 아름다웠던 우리 이 순간을 저 별에 담아서 we fell in love see the star be your star yeah yeah they called it milky way 쏟아져 머리 위로 넌 나를 업고 모래사장을 뛰어다녀 yeah 그중 가장 예쁜 저 별을 찾아서 밤이 새도록 뛰어다니고 stars are over me,별 보러 갈래?,볼빨간사춘기,사춘기집Ⅰ 꽃기운,2019.04.02,"인디음악, 포크/블루스"
