,song_id,lyrics,title,artist,album,release,genre
291,9620471,바보야 오늘은 안된다고 말하지마 오늘만큼은 내게도 꼭 기회를 줘 사랑스럽게 웃는 것도 예쁘게 말하는 것도 많이 연습했어 보고 싶어도 참으라고 하지마 Baby 난 좀 억지 부리는 것도 맞아 오늘도 내 눈물 연기로 받아낸 너와의 데이트 보고 싶어도 매일 꾹 참고 있어도 나는 네가 안아주기만 하면 샤르르르르 녹아 Yeah Baby You You You Yeah Yeah You You You Yeah Yeah  Baby 난 좀 욕심부리는 것도 맞아 오늘도 못되게 떼를 써 받아낸 너와의 데이트 사랑한다고 매일 꼭 표현 못해도 나는 네가 안아주기만 하면 샤르르르르 녹아 Yeah Baby You You You Yeah Yeah You You You Yeah Yeah You You You Yeah Yeah You You You Yeah 서투른 내 맘이 너에게 닿을까 봐 사실 손잡는 것도 많이 떨리는 난데 오늘도 배웠는걸 널 더 닮아가던걸 이젠 내가 널 닮아서 함께 웃고 있던걸 Yeah You Woo Yeah You You You Yeah Yeah 그대를 닮아서 마음이 더 큰 사람이 되면 그대를 내 품 안에 꼭 안아 줄래요 You You You Yeah Yeah You You You Yeah Yeah,You(=I),볼빨간사춘기,Full Album RED PLANET,2016.08.29,"인디음악, 포크/블루스"
292,5760115,그녀가 떠나가요 나는 아무것도 할 수 없어요 사랑이 떠나가요 나는 바보처럼 멍하니 서 있네요 멀어지는 그 뒷모습만을 바라보다 작은 점이 되어 사라진다 시간이 지나면 또 무뎌질까 옛 생각이 나 니 생각이 나 IF YOU IF YOU 아직 너무 늦지 않았다면 우리 다시 돌아갈 수는 없을까 IF YOU IF YOU 너도 나와 같이 힘들다면 우리 조금 쉽게 갈 수는 없을까 있을 때 잘할 걸 그랬어 그대는 어떤가요 정말 아무렇지 않은 건가요 이별이 지나봐요 그댈 잊어야 하지만 쉽지가 않네요 멀어지는 그 뒷모습만을 바라보다 작은 점이 되어 사라진다 누군갈 만나면 위로가 될까 옛 생각이 나 니 생각이 나 IF YOU IF YOU 아직 너무 늦지 않았다면 우리 다시 돌아갈 수는 없을까 IF YOU IF YOU 너도 나와 같이 힘들다면 우리 조금 쉽게 갈 수는 없을까 있을 때 잘할 걸 그랬어 오늘같이 가녀린 비가 내리는 날이면 너의 그림자가 떠오르고 서랍 속에 몰래 넣어둔 우리의 추억을 다시 꺼내 홀로 회상하고 헤어짐이란 슬픔의 무게를 난 왜 몰랐을까 IF YOU IF YOU IF YOU IF YOU 아직 너무 늦지 않았다면 우리 다시 돌아갈 수는 없을까 IF YOU IF YOU IF YOU IF YOU 너도 나와 같이 힘들다면 우리 조금 쉽게 갈 수는 없을까 있을 때 잘할 걸 그랬어,IF YOU,BIGBANG,D,2015.07.01,포크/블루스
293,3849486,잊어야 한다는 마음으로 내 텅 빈 방문을 닫은 채로 아직도 남아 있는 너의 향기 내 텅 빈 방 안에 가득한데 이렇게 홀로 누워 천정을 보니 눈앞에 글썽이는 너의 모습 잊으려 돌아 누운 내 눈가에 말 없이 흐르는 이슬방울들 지나간 시간은 추억 속에 묻히면 그만인 것을 나는 왜 이렇게 긴긴 밤을 또 잊지 못해 새울까 창 틈에 기다리던 새벽이 오면 어제 보다 커진 내 방 안에 하얗게 밝아온 유리창에 썼다 지운다 널 사랑해 밤하늘에 빛나는 수많은 별들 저마다 아름답지만 내 맘속에 빛나는 별 하나 오직 너만 있을 뿐이야 창 틈에 기다리던 새벽이 오면 어제 보다 커진 내 방 안에 하얗게 밝아온 유리창에 썼다 지운다 널 사랑해 하얗게 밝아온 유리창에 썼다 지운다 널 사랑해,잊어야 한다는 마음으로,김광석,김광석 '나의 노래' Box Set,2012.07.09,포크/블루스
294,3568916,나 그대가 너무 좋은데 말하고 싶은데 용기가 안나 나도 그대가 너무 좋은데 말하고 싶은데 용기가 안나 사랑해 말하고 싶은데 이렇게 속만 태우다가 그대가 떠나가 버릴까 늘 바보같이 걱정만 하는 우리 오늘은 떨리는 맘으로 그대 바라보며 고백할게요 나도 오늘은 용기낼래요 그대 바라보며 고백할게요 사랑해 말하고 싶은데 이렇게 속만 태우다가 그대가 떠나가 버릴까 늘 바보같이 걱정만 하는 우리 그대 눈길보면 당황해서 눈을 돌리고 그대 앞에서면 바보같이 얼굴 붉히고 그대를 사랑한다 수없이 연습하고 연습했는데 말도 못하고 사랑해 말하고 싶은데 이렇게 속만 태우다가 그대가 떠나가 버릴까 늘 바보같이 걱정만 하는 우리,"그대와 나, 설레임 (Feat. 소울맨)",어쿠스틱 콜라보,Unplugged,2011.10.10,"인디음악, 포크/블루스"
295,1047566,그대 보내고 멀리 가을새와 작별하듯  그대 떠나보내고 돌아와 술잔 앞에 앉으면  눈물 나누나   그대 보내고 아주 지는 별빛 바라볼 때  눈에 흘러 내리는 못다한 말들  그 아픈 사랑 지울 수 있을까   어느 하루 비라도 추억처럼 흩날리는 거리에서  쓸쓸한 사랑되어 고개숙이면 그대 목소리   너무 아픈 사랑은 사랑이 아니었음을  너무 아픈 사랑은 사랑이 아니었음을   어느 하루 바람이 젖은 어깨 스치며 지나가고  내 지친 시간들이 창에 어리면 그대 미워져   너무 아픈 사랑은 사랑이 아니었음을  너무 아픈 사랑은 사랑이 아니었음을   이제 우리 다시는 사랑으로 세상에 오지 말기  그립던 날들도 묻어 버리기 못다한 사랑   너무 아픈 사랑은 사랑이 아니었음을  너무 아픈 사랑은 사랑이 아니었음을 -,너무 아픈 사랑은 사랑이 아니었음을,김광석,김광석 Best,2005.12.12,포크/블루스
296,5371629,너의 소식을 듣고 난 멍하니 있어 하루온종일 널 생각 하나봐 일도 잘 안잡히고 집중이 안돼 괜찮았는데 요즘 따라 니가 생각나 이맘때쯤에 웃고 있던 너와 내가 생각 나는데 니 무릎을 베고 하늘을 보며 먼 훗날 우리 얘길 했는데 사랑한다고  내 귓가에 말해주던  너의 목소리 그게 뭐라고 또 생각나 하나둘씩 떠오르지  함께한 추억들이그리워지네 난 다짐을 했었지 너의 근황들을 안보고 지내고 싶었는데 그게 말처럼 안 돼  나혼자 아픈건가 봐 넌 잘지내나 봐 저녁이 오면 사람들 속에 우리도 섞여 걸었었지 손을 잡고서 하지만 이제 네가 없어서 너무 외로워 사랑한다고 내 귓가에  말해주던 너의 목소리 그게 뭐라고 또 생각나 하나둘씩 떠오르지  함께한 추억들이 그리워지네 그 누군가 내게 말을했지 세월이 곧 약일꺼라고 널 많이 사랑했나봐 그랬나봐 이젠 잊을 때도 됐는데 사랑한다고 좋아한다고  매일 같이 말해주던 네 목소리 잊지못하고 하나둘씩 떠오르지  함께 한 추억들이 그리워지네,그게 뭐라고,어쿠루브,그게 뭐라고,2014.09.04,"인디음악, 포크/블루스"
297,31172510,아무렇지 않게 넌 평소와 같은 말투로 오늘 밤에 만나자 준비하고 널 만나러 갔어 장미꽃을 손에 꼭 들고서 집 앞에서 널 기다렸어 좋아할 너를 생각하면서 돌아오는 말은 헤어지자고 그 말하러 나온 거라고 순간 난 얼어버렸어 이제는 널 보고 싶어도  볼 수 없대 밤에 통화도 못한대 넌 그래도 괜찮니 널 잊고 행복하길 바란대 우 네 사랑은 여기까지 래요 먹먹하게 돌아오던 그 밤은 제일 추운 여름밤이었어 차가워진 우리 사이처럼 집에 들어와 침대에 누워서 탁자 위 사진을 보았어 우리 참 좋았었는데 이제는 널 보고 싶어도  볼 수 없대 밤에 통화도 못한대 넌 그래도 괜찮니 널 잊고 행복하길 바란대 우 네 사랑은 여기까지 래요 헤어진 그날 밤 너는  유난히도 예뻤어 그 모습을 기억할게 이제는 널 보고 싶어도  볼 수 없대 밤에 통화도 못한대 넌 그래도 괜찮니 널 잊고 행복하길 바란대 우 네 사랑은 여기까지 래요 내 사랑은 아직,헤어지던 밤,어쿠루브,헤어지던 밤,2018.07.07,"인디음악, 포크/블루스"
298,7877311,쳐다보지 않아도 내 맘은 널 향해 있고 널 바라보길 바라고 쳐다본다 싶으면 혹시나 마주칠까 봐 쳐다보지도 못하고 어딜 보는 걸까 혹시 날 보는 걸까 너도 내 마음과 같은 맘이길 내 몸이 말을 안 들어 마음은 널 좋아한다 하는데 내 눈은 네 눈을 피해 내 몸이 말을 안 들어 마음은 다가가라고 하는데 그렇게 원하지 않던 부끄럼만 생겼네 한 번은 남자 답게 인사해 보고 싶은데 안녕이란 말도 못 꺼내 다른 친구들 앞에서 말 잘하는 수다쟁이 너 앞에 서면 벙어리 어딜 보는 걸까 혹시 날 보는 걸까 너도 내 마음과 같은 맘이길 내 몸이 말을 안 들어 마음은 널 좋아한다 하는데 내 눈은 네 눈을 피해 내 몸이 말을 안 들어 마음은 다가가라고 하는데 그렇게 원하지 않던 부끄럼만 생겼네 어쩌다 마주칠 때면 내 몸은 oh no 내 맘은 want her 너도 내 마음과 같은 맘이길 내 몸이 말을 안 들어 마음은 널 좋아한다 하는데 내 눈은 네 눈을 피해 내 몸이 말을 안 들어 마음은 다가가라는데 부끄럼만 내 몸이 말을 안 들어 마음은 널 좋아한다 하는데 내 눈은 네 눈을 피해 내 몸이 말을 안 들어 마음은 다가가라는데 부끄럼만 나 생겼네,부끄럼,멜로망스,bright #4,2015.10.07,"인디음악, 포크/블루스"
299,1047561,서른 즈음에  또 하루 멀어져 간다  내뿜은 담배 연기처럼  작기만한 내 기억 속에  무얼 채워 살고 있는지   점점 더 멀어져 간다  머물러 있는 청춘인 줄 알았는데  비어가는 내 가슴 속엔  더 아무 것도 찾을 수 없네   계절은 다시 돌아 오지만  떠나간 내 사랑은 어디에  내가 떠나 보낸 것도 아닌데  내가 떠나 온 것도 아닌데   조금씩 잊혀져 간다  머물러 있는 사랑인 줄 알았는데  또 하루 멀어져 간다  매일 이별하며 살고 있구나  매일 이별하며 살고 있구나   점점 더 멀어져 간다  머물러 있는 청춘인 줄 알았는데  비어가는 내 가슴 속엔  더 아무 것도 찾을 수 없네   계절은 다시 돌아 오지만  떠나간 내 사랑은 어디에  내가 떠나 보낸 것도 아닌데  내가 떠나 온 것도 아닌데   조금씩 잊혀져 간다  머물러 있는 사랑인 줄 알았는데  또 하루 멀어져 간다  매일 이별하며 살고 있구나   매일 이별하며 살고 있구나 -,서른 즈음에,김광석,김광석 Best,2005.12.12,포크/블루스
300,3894276,오래 전에 함께 듣던 노래가 발걸음을 다시 멈춰서게 해 이 거리에서 너를 느낄 수 있어 널 이 곳에서 꼭 다시 만날 것 같아 너 일까봐 한번더 바라보고 너 일까봐 자꾸 돌아보게 돼 어디선가 같은 노래를 듣고 날 생각하며 너 역시 멈춰있을까 오래 전에 함께 듣던 노래가 거리에서 내게 우연히 들려온 것처럼  살아가다 한번쯤 우연히 만날 것 같아 사랑했던 그 모습 그대로 내 사랑이 그대로인 것처럼 발걸음이 여길  찾는 것처럼 꼭 만날꺼야 지금 이 노래처럼 날 사랑하는 네 맘도 같을테니까 오래 전에 함께 듣던 노래가 거리에서 내게 우연히 들려온 것처럼 살아가다 한번쯤 우연히 만날 것 같아 사랑했던 그 모습 그대로 운명처럼 아니면 우연처럼 우리가 다시 예전처럼 만날 수 있다면 너에게 나 해주고 싶은 말이 하나 있어 널 다시는 놓치지 않을게  오래 전에 함께 듣던 노래가 거리에서 내게 우연히 들려온 것처럼 살아가다 한번쯤 우연히 만날 것 같아 사랑했던 그 모습 그대로,오래된 노래,스탠딩 에그,오래된 노래,2012.09.04,"인디음악, 포크/블루스"
301,33346447,I thought that you remember but it seems that you forgot It’s hard for me to blame you when you were already lost oh yeah I’m tired of always waiting oh yeah yeah I see you changed your number That’s why you don’t get my calls I gave you all of me now you don’t want to be involved oh yeah yeah I really gotta face it oh yeah yeah  I just wanna be the one But to you we’re already done Tell me why’d you have to hit and run me Now I’m all alone crying ugly You broke my heart just for fun Took my love and just left me numb Now it’s 8 in the morning Hate in the morning All because of you  Another story that’s sad and true  I can feel the pain can you You had to be the one to let me down  To color me blue Hate to see you with someone new I’ll put a curse on her and you Ain’t no looking back now you’re dead and gone  My love is gone too  All my love is gone All my love is gone All my love is gone All my love is gone Now you’re dead and gone  All my love is gone and the hate has grown Standing all alone and I’m searching for something But I can’t feel nothin’ I pack my bags and go  This don’t feel like home Too much darkness for a rainbow I feel so used How am I supposed to live without you I refuse yeah  I just wanna be the one But to you we’re already done Tell me why’d you have to hit and run me Now I’m all alone crying ugly You broke my heart just for fun Took my love and just left me numb Now it’s 8 in the morning Hate in the morning All because of you  Another story that’s sad and true  I can feel the pain can you You had to be the one to let me down  To color me blue Hate to see you with someone new I’ll put a curse on her and you Ain’t no looking back now you’re dead and gone  My love is gone too  All my love is gone All my love is gone All my love is gone All my love is gone Now you’re dead and gone,Gone,로제 (ROSÉ),R,2021.03.12,포크/블루스
302,8124417,꽃이 언제 피는지  그딴 게 뭐가 중요한데 날씨가 언제 풀리는지  그딴 거 알면 뭐 할 건데 추울 땐 춥다고 붙어있고 더우면 덥다고 니네 진짜 이상해 너의 달콤한 남친은 사실 피씨방을 더  가고 싶어하지 겁나 피곤하대 봄이 그렇게도 좋냐 멍청이들아 벚꽃이 그렇게도 예쁘디 바보들아 결국 꽃잎은 떨어지지  니네도 떨어져라 몽땅 망해라 망해라 아무 문제 없는데  왜 나는 안 생기는 건데 날씨도 완전 풀렸는데  감기는 왜 또 걸리는데 추울 땐 추워서 안생기고 더우면 더워서 인생은 불공평해 너의 완벽한 연애는 아직 웃고 있지만 너도 차일거야 겁나 지독하게 봄이 그렇게도 좋냐 멍청이들아 벚꽃이 그렇게도 예쁘디 바보들아 결국 꽃잎은 떨어지지 니네도 떨어져라 몽땅 손 잡지 마 팔짱 끼지 마 끌어 안지 마 제발 아무것도 하지 좀 마 설레지 마 심쿵하지 마 행복하지 마 내 눈에 띄지 마 봄이 그렇게도 좋냐 멍청이들아 벚꽃이 그렇게도 예쁘디 바보들아 결국 꽃잎은 떨어지지 니네도 떨어져라 몽땅 망해라 망해라 망해라 망해라,봄이 좋냐??,10CM,3.2,2016.04.01,"인디음악, 포크/블루스"
303,31709523,안돼 그만둬 거기까지 해 더 다가가면 너 정신 못 차려 안돼 그만해 꽃은 넣어둬 그냥 좀 바람이 불게 놔줘 왜 그럴까 사람들은 그냥 봄기운이 좋아 눈치 없이 밖을 나가는 걸까 왜 이럴까 뭐가 설렌다고 봄바람이 좋아 내 맘도 모르고 더 불어와 flower sunshine 완벽한 하루를 사실 너와 걸을 수 있다면 얼마나 좋을까 좋아한다고 말하기가 무서워서 네 곁을 맴돌고 있는 난 벚꽃도 뭐고 다 필요 없어 나는 네 곁에 있고 싶어 딱 붙어서 봄이 지나갈 때까지 다른 사람 다 사라져라 나만 봄 왜 그럴까 사람들은 그냥 봄기운이 좋아 눈치 없이 밖을 나가는 걸까 왜 이럴까 뭐가 설렌다고 봄바람이 좋아 내 맘도 모르고 더 불어와 flower sunshine 완벽한 하루를 사실 너와 걸을 수 있다면 얼마나 좋을까 좋아한다고 말하기가 무서워서 네 곁을 맴돌고 있는 난 벚꽃도 뭐고 다 필요 없어 나는 네 곁에 있고 싶어 딱 붙어서 봄이 지나갈 때까지 다른 사람 다 사라져라 언제 봄이 왔는지 내 맘도 모르고 봄바람이 자꾸만 불어와 네 곁에 딱 붙어서 떨어지지 않고 싶어 내 맘을 이제 말하고 싶어 벚꽃도 뭐고 다 필요 없어 나는 네 곁에 있고 싶어 딱 붙어서 봄이 지나갈 때까지 다른 사람 다 사라져라 나만 봄,"나만, 봄",볼빨간사춘기,사춘기집Ⅰ 꽃기운,2019.04.02,"인디음악, 포크/블루스"
304,30611680,이건 세상에서 제일 비싼 단독 공연 가수는 나고 관객은 너 하나 화려한 막이 이제 곧 올라가기 전에 그저 몇 가지만 주의해줘요 세상에서 제일 편한 옷을 갈아 입고 제일 좋아하는 자리에 누워 배터리가 바닥나지 않게 조심하고 통화상태를 항상 유지해줘요 듣고 싶은 노래를 말 만해 everything 입이 심심할 때는 coffee popcorn anything 너무 부담주진 말고 편하게 들어줘 아님 내가 너무 떨리니까 오직 너에게만 감동적인 노래 오직 너를 웃게 하기 위한 코너 네가 너무 설레 잠 못 들게 만들 거야 지금이야 크게 소리 질러줘 누구보다 특별한 너의 취향을 알아 달콤한데 슬픈 듯 아찔하게 맞지 근데 다음 곡이 중요해 볼륨 높여봐 기억 나니 우리 그 날 그 노래 내가 너무 진지해 보여도 웃지마 누가 봐도 완벽한 노래는 아니지만 많이 연습한 부분을 너 때문에 틀리잖아 아직 나는 너무 떨리니까 오직 너에게만 감동적인 노래 오직 너를 웃게 하기 위한 코너 네가 너무 설레 잠 못 들게 만들 거야 지금이야 크게 소리 질러 이 공연은 거의 다 끝나 가고 있어 어땠는지 말해줘 문자로 너무나 아쉽지만 졸린 거 이미 알고 있어 기대해줘 마지막 곡 이 중에서도 제일 감동적인 노래 오직 너를 웃게 하기 위한 코너 네가 너무 설레 잠 못 들게 만들 거야 지금이야 제일 원하는 걸 말해 어떤 노래를 다시 듣고 싶어 사실 내가 원해 네가 너무 설레 잠 못 들지 모르지만 앵콜이야 크게 소리 질러줘 이건 세상에서 제일 비싼 단독공연 가수는 나고 관객은 너 하나,폰서트,10CM,4.0,2017.09.01,"인디음악, 포크/블루스"
305,5700639,툭 웃음이 터지면 그건 너 쿵 내려앉으면은 그건 너 축 머금고 있다면 그건 너 둥 울림이 생긴다면 그건 너 그대를 보며 나는 더운 숨을 쉬어요 아픈 기분이 드는 건 그 때문이겠죠 나를 알아주지 않으셔도 돼요 찾아오지 않으셔도 다만 꺼지지 않는 작은 불빛이 여기 반짝 살아있어요 영영 살아있어요 눈을 떼지 못 해 하루종일 눈이 시려요 슬픈 기분이 드는 건 그 때문이겠죠 제게 대답하지 않으셔도 돼요 달래주지 않으셔도 다만 꺼지지 않는 작은 불빛이 여기 반짝 살아있어요 세상 모든 게 죽고 새로 태어나 다시 늙어갈 때에도 감히 이 마음만은 주름도 없이 여기 반짝 살아있어요 영영 살아있어요 영영 살아있어요,마음,아이유,마음,2015.05.18,포크/블루스
306,32583036,나를 보면 숨어요 어디든 자유롭게 날아요 이 날씨도 그댈 위한 거예요 난 너를 찾아요 그러면 그댄 어디든 있어요 내 손 위에 머물러 잠시 앉아 쉬어요 몰래몰래 그대를 보아요 사랑스런 날개 그댄 어디서 온 건가요 말하지 못한 채 나 손을 뻗어요 보랏빛 날개 그대는 달아요 내 맘이 그런 것처럼 그대 맘이 그런 것처럼 yeah 나를 보면 숨어요 어디든 자유롭게 날아요 이 날씨도 그댈 위한 거예요 난 너를 찾아요 그러면 그댄 어디든 있어요 내 손 위에 머물러 잠시 앉아 쉬어요 가만히 난 몰래몰래 그대를 보아요 사랑스런 날개 그댄 어디서 온 건가요 말하지 못한 채 나 손을 뻗어요 보랏빛 날개 그대는 달아요 내 맘이 그런 것처럼 그대 맘이 그런 것처럼 yeah 나를 보면 숨어요 어디든 자유롭게 날아요 이 날씨도 그댈 위한 거예요 난 너를 찾아요 그러면 그댄 어디든 있어요 내 손 위에 머물러 잠시 앉아 쉬어요 설렘이 가득하죠 이 날씨도 그 기분까지도 난 너를 찾아요 그러면 그댄 어디든 있어요 내 손 위에 머물러 잠시 앉아 쉬어요 내 어깨에 기대어 잠시 눈을 감아요,나비와 고양이 (feat.백현 (BAEKHYUN)),볼빨간사춘기,사춘기집Ⅱ 꽃 본 나비,2020.05.07,"인디음악, 포크/블루스"
307,30657311,나는 한때 내가 이 세상에 사라지길 바랬어 온 세상이 너무나 캄캄해 매일 밤을 울던 날 차라리 내가 사라지면 마음이 편할까 모두가 날 바라보는 시선이 너무나 두려워 아름답게 아름답던 그 시절을 난 아파서 사랑 받을 수 없었던 내가 너무나 싫어서 엄마는 아빠는 다 나만 바라보는데 내 마음은 그런 게 아닌데 자꾸만 멀어만 가 어떡해 어떡해 어떡해 어떡해 시간이 약이라는 말이 내게 정말 맞더라고 하루가 지나면 지날수록 더 나아지더라고 근데 가끔은 너무 행복하면 또 아파올까 봐 내가 가진 이 행복들을 누군가가 가져갈까 봐 아름다운 아름답던 그 기억이 난 아파서 아픈 만큼 아파해도 사라지지를 않아서 친구들은 사람들은 다 나만 바라보는데 내 모습은 그런 게 아닌데 자꾸만 멀어만 가 그래도 난 어쩌면 내가 이 세상에 밝은 빛이라도 될까 봐 어쩌면 그 모든 아픔을 내딛고서라도 짧게 빛을 내볼까 봐 포기할 수가 없어 하루도 맘 편히 잠들 수가 없던 내가 이렇게라도 일어서 보려고 하면 내가 날 찾아줄까 봐 아아아아아아아 아아아아아아아 아아아아아아아 아아아아아아아 얼마나 얼마나 아팠을까 얼마나 얼마나 아팠을까 얼마나 얼마나 얼마나 바랬을까,나의 사춘기에게,볼빨간사춘기,Red Diary Page.1,2017.09.28,"인디음악, 포크/블루스"
308,5466962,나도 알아 나의 문제가 무엇인지 난 못났고 별 볼 일 없지 그 애가 나를 부끄러워 한다는 게 슬프지만 내가 뭐라고 빛나는 누군갈 좋아하는 일에  기준이 있는 거라면 이해할 수 없지만 할 말 없는걸 난 안경 쓴 샌님이니까 내가 이렇게 사랑하는데 이렇게 원하는데 나는 아무것도 할 수 없고 바라만 보는데도 내가 그렇게 불편할까요 내가 나쁜 걸까요 아마도 내일도 그 애는 뒷모습만 이제 알아 나의 할 일이 무엇인지 다 포기하고 참아야 하지 저 잘 나가는 너의 남자친구처럼 되고 싶지만 불가능하지 빛나는 누군갈 좋아하는 일에 기준이 있는 거라면 이해할 수 없지만 할 말 없는걸 난 안경 쓴 샌님이니까 내가 이렇게 사랑하는데 이렇게 원하는데 나는 아무것도 할 수 없고 바라만 보는데도 내가 그렇게 불편할까요 내가 나쁜 걸까요 아마도 내일도 그 애는 나는 왜 이런 사람 이런 모습이고 이런 사랑을 하고 나는 아무것도 될 수 없고 바라만 보는데도 내가 그렇게 불편하니까 내가 나쁜 거니까 아마도 내일도 그 애는 나도 알아 나의 문제가 무엇인지,스토커,10CM,3.0,2014.11.19,"인디음악, 포크/블루스"
309,30163110,안녕 오늘도 같은 자리 버스 창가에 기대 앉은 네게 인사를 해 Hi 역시 넌 받아 주지를 않네 인기 많고 잘생긴 넌 내게만 그렇게 쌀쌀하게 굴더라 근데 Last Night 기억나 넌 내가 좋다고 했어 그 예쁜 가로등 아래서 넌 내가 좋다고 말했어 다음부턴 모른 척 아닌 척해도 You Have To Know That 확신을 해야 돼 넌 그날 넌 내가 좋다고 했어 Yeah If You Like Me Or Love Me Just Say Yes Yes Yes And Then I'm Your Girlfriend And You're My Boyfriend 어서 내게 좋다고 말해 줘 몰래 오늘도 도서관 맨 앞자리에 기대 앉은 네게 인사를 해 Oh Boy 역시 넌 받아 주지를 않네 인기 많고 잘생긴 넌 내게만 그렇게 쌀쌀하게 굴더라 근데 Last Night 기억나 넌 내가 좋다고 했어 그 예쁜 가로등 아래서 넌 내가 좋다고 말했어 다음부턴 모른 척 아닌 척해도 You Have To Know That 확신을 해야 돼 넌 그날 넌 내가 좋다고 했어 Yeah If You Like Me Or Love Me Just Say Yes Yes Yes And Then I'm Your Girlfriend And You're My Boyfriend 어서 내게 좋다고 말해 줘 Oh 널 참 많이 좋아하는 난데 우린 이어질 수 없는 걸까 내 긴 교복 치마가 부끄러워 초라해 Yeah 네 곁엔 항상 키 크고 예쁜 애들이 넘치는데 Woo If You Like Me If You Love Me Yeah And Then I'm Your Girlfriend And You're My Boyfriend 어서 내게 좋다고 말해 줘 If You Like Me Or Love Me Just Say Yes Yes Yes And Then I'm Your Girlfriend And You're My Boyfriend 어서 내게 좋다고 말해 줘,좋다고 말해,볼빨간사춘기,Full Album RED PLANET 'Hidden Track',2016.12.21,"인디음악, 포크/블루스"
