,song_id,lyrics,title,artist,album,release,genre
867,5501624,어둠이 짙은 저녁 하늘 별빛 내 창에 부서지고 외로운 밤을 홀로 지샌 내 모습 하얀 별 나를 비춰주네 불빛 하나 둘 꺼져갈 때 조용히 들리는 소리 가만히 나에게서 멀어져 가면 눈물 그 위로 떨어지네  외롭게 나만 남은 이 공간 되올 수 없는 시간들 빛바랜 사진속에 내 모습은 더욱 더 쓸쓸하게 보이네 아 이렇게 슬퍼질 땐 거리를 거닐자 환하게 밝아지는 내 눈물 어둠이 짙은 저녁 하늘 별빛 내 창에 부서지고 외로운 밤을 홀로 지샌 내 모습 하얀 별 나를 비춰주네 외롭게 나만 남은 이 공간 되올 수 없는 시간들 빛바랜 사진속에 내 모습은 더욱 더 쓸쓸하게 보이네  아 이렇게 슬퍼질 땐 노래를 부르자 환하게 밝아지는 내 눈물 아 이렇게 슬퍼질 땐 노래를 부르자 삶에 가득 여러 송이 희망을 환하게 밝아지는 내 눈물,혼자 남은 밤,김광석,김광석 4집 리마스터링앨범,2014.12.11,포크/블루스
868,31425654,역시나 그대 언제나 problem 내겐 생각의 끝엔 두 팔을 벌려 웃으며 날 기다리는 너 어제도 그대 오늘도 travel again 머릿속 가득 차버린 너만 온종일 날 괴롭히는데 oh trouble trouble trouble 그대는 bubble bubble bubble 조금은 다른 영혼을 가진 사람인가봐요 그런가요 oh trouble trouble trouble 그대는 bubble bubble bubble 나와는 다른 그대를 가진 나는 어떡하죠 말해줘요 my trouble 어제도 그대 오늘도 travel again 머릿속 가득 차버린 너만 온종일 날 괴롭히는데 oh trouble trouble trouble 그대는 bubble bubble bubble 조금은 다른 영혼을 가진 사람인가봐요 그런가요 oh trouble trouble trouble 그대는 bubble bubble bubble 나와는 다른 그대를 가진 나는 어떡하죠 말해줘요 my trouble 그때 왜 내게 그렇게 설레게 한 거죠 이럴 거면 I wanna go back oh trouble trouble trouble 그대는 bubble bubble bubble 조금은 다른 영혼을 가진 사람인가봐요 그대 trouble trouble trouble 그대는 bubble bubble bubble 나와는 다른 그대를 가진 나는 어떡하죠 말해줘요 my trouble,My Trouble,볼빨간사춘기,WHY : 당신이 연인에게 차인 진짜 이유 OST - Part.1,2018.11.15,"포크/블루스, 국내드라마"
869,33010630,나는 어릴 적 밤이 되면 까만 밤이 싫어 눈을 감고서 하얀 밤을 상상했고 너는 언젠가 밤이 되면 하얀 밤이 싫어 눈을 맞추고 내게 다가와 까맣게 짙어진 밤 나는 문득 이 밤을 사랑하네 아 누가 누군가의 마음이 되면 바라고 바라던 말 기어코 말하고 말 테지 너와 문득 닮아가게 됐다고 우리 언젠가 먼 미래에 남이 되어서도 등을 맞대고 웃어넘길 수 있을까 이런 모진 말로 너에게 짐이 될 순 없기에 눈을 맞추고 네게 다가가 Am I falling down the dark 그저 버거운 맘일까 나 두려운지도 몰라 Am I feeling love my babe 이 밤을 기억할까 까맣게 짙어진 밤 나는 문득 이 밤을 사랑하네 아 누가 누군가의 마음이 되면 바라고 바라던 말 기어코 말하고 말 테지 너를 문득 사랑하게 됐다고,누군가의 마음이 되면,예빛,누군가의 마음이 되면,2020.10.23,"인디음악, 포크/블루스"
870,33055517,문득 그런 날이 있잖아 가만히 앉아있다 눈물이 날 것 같은 그런 날 전화기를 꺼내 들어 사랑한다 얘기를 해 지금이 아니면 안 될 것 같았어 빠르게 지나가 버렸던 따듯했던 그날의 햇살 그때로 다시 눈을 감아 하늘색 문을 열면 펼쳐지던 꿈속 풍경 아무도 믿지 않을까 얘기하지 못했던 그날의 기억들을 나는 알고 있었어 꿈이 아니라는 걸 이제는 말할 수 있어 그게 바로 너였어 문득 그런 날이 있잖아 평범한 하루 일상 속에 무언가 반짝이는 그런 날 꺼내든 전화기 속 가장 아끼던 음악을 틀어 이 순간 너와 꼭 듣고 싶었어 너무도 짧게 느껴졌던 아름답던 그날의 멜로디 그때로 그때로 다시 눈을 감아 하늘색 문을 열면 펼쳐지던 꿈속 풍경 아무도 믿지 않을까 얘기하지 못했던 그날의 기억들을 나는 알고 있었어 꿈이 아니라는 걸 이제는 말할 수 있어 그게 바로 너였어 다르게 걸어왔던 우리가 만나게 되고 모든 것을 나눴고 다시 돌아 걸었고 시간이 지났을 뿐인데 그날의 문을 열면 아직 그대로인 채 아무도 믿지 않아도 내겐 중요치 않았던 그날의 기억들을 나는 알고 있었어 꿈이 아니라는 걸 이제는 말할 수 있어 그게 바로 너였어 그게 바로 너였어 그게 바로 너였어 내 모든 것이 너였어,풍경,적재,2006,2020.11.12,포크/블루스
871,1047559,잊어야 한다는 마음으로  내 텅빈 방문을 닫은 채로 아직도 남아 있는 너의 향기  내 텅빈 방안에 가득한데  이렇게 홀로 누워 천정을 보니  눈앞에 글썽이는 너의 모습 잊으려 돌아 누운 내 눈가에  말없이 흐르는 이슬 방울들  지나간 시간은 추억속에 묻히면  그만인 것을 나는 왜 이렇게 긴긴 밤을  또 잊지 못해 새울까  창틈에 기다리던 새벽이 오면  어제보다 커진 내 방안에 하얗게 밝아온 유리창에  썼다 지운다 널 사랑해  밤하늘에 빛나는  수많은 별들 저마다 아름답지만 내 맘속에 빛나는 별 하나  오직 너만 있을 뿐이야  창틈에 기다리던 새벽이 오면  어제보다 커진 내 방안에 하얗게 밝아온 유리창에  썼다 지운다 널 사랑해,잊어야 한다는 마음으로,김광석,김광석 Best,2005.12.12,포크/블루스
872,32818943,하얀 꽃이 피는 날엔 어김없이 나를 찾아온다구요 이 밤도 그믐달도 지는 날엔 맘이 자꾸 내일로 가요 훗날 궂은 비가 내려와도 나는 그 자리에 있어요 아무도 찾지 않는 그곳에서 멍하니 하늘만 보네요 훗날 검은 비가 내려와도 내 맘 절대 물들지 않아요 아무도 찾지 않는 나를 따라 애꿎은 비만 내려요,소낙비,예빛,그대와 춤을,2020.07.29,"인디음악, 포크/블루스"
873,30497180,날 스쳐 지나간  수많은 사람들 중에  단 한 사람만이  날 멈춰 서게 했어  갈 곳을 잃었던  수많은 나의 시간이  이제야 뒤늦게  주인을 찾은 거야  키가 작더라도 아담해서  나랑 어울려 괜찮아  싫어하던 노랠 네가 부르면  또 그 노래가 괜찮아  항상 늦게 와서 혼자 기다려도  너라면 괜찮아  이 모든 게 너를 만난 이후로  처음 겪는 일  너라면 괜찮아  잊어버리지마  너라면 괜찮아  잊어버리지마  너라면 괜찮아  나의 모든 시간 너에게 다 줄게  그동안 불렀던  수많은 사랑 노래가  이제야 뒤늦게  주인을 찾은 거야  make up 안 해도 넌 예쁘니까  그냥 나와도 괜찮아  늦게까지 나를 데리고 다니며  쇼핑해도 괜찮아  매일 밤늦도록 전화해도  할 얘기가 많아 괜찮아  이 모든 게 너를 만난 이후로  처음 겪는 일  너라면 괜찮아  잊어버리지마  너라면 괜찮아  잊어버리지마  너라면 괜찮아  나의 모든 시간 너에게 다 줄게  네 모든 시간도  네 모든 세상도  나에게 준다면  평생 아끼고 잘 간직 해줄게  너라면 괜찮아  잊어버리지마  너라면 괜찮아  잊어버리지마  너라면 괜찮아  나의 모든 시간 너에게 다 줄게  너라면 괜찮아  잊어버리지마  너라면 괜찮아  잊어버리지마  너라면 괜찮아  나의 모든 시간 너에게 다 줄게  너라면 괜찮아 잊어버리지마 너라면 괜찮아 잊어버리지마 너라면 괜찮아 나의 모든 시간 너에게 다 줄게,너라면 괜찮아,스탠딩 에그,너라면 괜찮아,2017.06.28,"인디음악, 포크/블루스"
874,4583491,갤럭시 너 혹시 나와 같이  걸어가 볼래 반짝이는 은하 너머 손잡고  나와 같이 걸어가 볼래 누가 살고 있나 아무도 몰라 그 너머 뭐 있는지 누구도 몰라 다만 분명히 화려한 무지개  너머 내 꿈 둥 둥 떠다닐 거예요 Tap the galaxy oh Dab the melody ya 할까 말까 고민 끝에 한여름날  쉬다 간 여우비 소리에 묻혀 말하지  못한 내 고백이 저 하늘 희미하게 반짝이고 있는 은하수로 흘러갔을까 갤럭시 너 혹시 나와 같이  날아가 볼래 반짝이는 팅커벨의 가루가 너와  나를 띄워 줄 거야 누가 숨어 우릴 볼지도 몰라 날 위한 축제가 있을지도 몰라 다만 분명히 영롱한 물안개  너머 내 꿈 둥 둥 떠다닐 거예요 Tap the galaxy oh Dap the melody ya 할까 말까 고민 끝에 한겨울밤  몰래 간 도둑눈에 숨이 멎어 도망가  버린 고백 말이 저 하늘 희미하게 반짝이고 있는 은하수로 흘러갔을까 갤럭시 너 혹시 나와 같이  걸어가 볼래 반짝이는 은하 너머 손잡고  나와 같이 걸어가 볼래 갤럭시 너 혹시 나와 같이  날아가 볼래 반짝이는 팅커벨의 가루가  너와 나를 띄워 줄 거야,Galaxy,AKMU (악동뮤지션),PLAY,2014.04.07,포크/블루스
875,33055519,너 없이도 햇살은 따듯했고  세상은 평온했고  바람은 불어왔어  너 없이도 잠에서 깨어났고  하루는 흘러갔고  다시금 잠들었어  이상하게도 그대로더라  모든 게 변해버릴 것 같았는데  모든 게 다 무너지는 줄 알았는데  사라질 것만 같았는데   그저 나 혼자뿐이었어  신기하게도 그대로더라  모든 게 변해버릴 것 같았는데   모든 게 다 무너지는 줄 알았는데  사라질 것만 같았는데  그저 나 혼자뿐이었어  항상 서로에게 기대왔던 마음이  언제나 곁에서 늘 지켜보던 모습이  이젠 그리워해도  보이지 않아   너의 모습이   너의 모든 게  너 없이도 햇살은 따듯했고  세상은 평온했고  하루는 흘러갔어,너 없이도,적재,2006,2020.11.12,포크/블루스
876,3713801,봄이 왔다 그녀가 왔다 봄이 왔다 그녀가 왔다 갈색머리를 휘날리며 푸른 바다를 건너 나비처럼 손짓하며 꽃으로 물들이며 봄이 왔다 그녀가 왔다 봄이 왔다 그녀가 봄을 몰고왔다 모든게 무지개 빛으로 젖어들어간다 정신을 차릴 수가 없다 봄이 왔다 그녀가 왔다 내일 내일 내일 바로 내일 그녀를 만나러 간다 봄이 왔다 그녀가 왔다 봄이 왔다 그녀가 왔다 봄이 왔다 그녀가 왔다 봄이 왔다 그녀가 왔다 봄이 왔다 그녀가 왔다 봄이 왔다 그녀가 왔다,봄이왔다,타루,Blah Blah,2012.02.21,"인디음악, 포크/블루스"
877,32479459,내 마음 한 켠에 놓아둔 빛바랜 사진첩을 펼쳐보아요 서툴기만 했었던 우리 모습은 돌아보니 사랑이었죠 저 먼 밤에는 그대와 속삭인 말들 향기처럼 남아서 작은 창문 틈 사이로 스며들어와 까만 방 안을 밝혀주네요 우리 이별을 마주하던 그 밤 아래 내 발자국을 새겨놓아요 언젠가 그대도 들르려나 곁에 두는 말 보고싶어 보고싶어 그대 가는 시간에 멀어진 우리 추억은 옅어져 가겠지만 잠들 수 없는 밤이면 다시금 찾아와 까만 밤 위에 수놓이네요 우리 이별을 마주하던 그 밤 아래 내 발자국을 새겨놓아요 언젠가 그대도 들르려나 곁에 두는 말 보고싶어 보고싶어 그대 혹시 마음 시린 계절이 온다면 그대 한 번쯤 이 밤을 찾을까요 우리 서로를 마주했던 그 밤 아래 나의 마음을 새겨놓아요 언젠가 그대에게 닿을까 전하고픈 말 보고싶어 보고싶어 그대 우리 마주하면 웃을 수 있을까 보고싶고 보고싶은 그대,우리 이별을 마주하던 그 밤 아래,그_냥,두_울,2020.03.23,"인디음악, 포크/블루스"
878,5380852,비 오는 거릴 걷다가 문득 나는 생각 조금 늦은 날 기다릴 너 조금씩 빨라진 걸음에 나는 더 숨이 가빠 와 감춰도 감춰 지지 않는 그 사랑 섞인 말투로 왜 이리 늦었냐 묻는 너는 우산을 접고  내 안으로 들어와 이렇게 비가 오는 날엔 나는 너의 손을 꼭 잡고 멀리멀리 날아가고 싶어 우산이 두 갠데 우린 하나만을 쓰고 이 길을 걷고 걷고 걷고 걸어 비 오는 거릴 걷고 있는 너와 나의 시간은  너무 빠른 건지 조금씩 느려 진 걸음의 우리 둘 걷는 곳 발 닿는 곳 마다 너와 만들을 추억이 오래오래 내 맘 깊은 곳 종소리로 울려 퍼졌음 좋겠어 이렇게 비가 오는 날엔 나는 너의 손을 꼭 잡고 멀리멀리 날아가고 싶어 우산이 두 갠데 우린 하나만을 쓰고 이 길을 걷고 걷고 걷고 걸어 비가 오는 날엔 내리는 빗 속 우산에 내리는 빗 속 우산에 우리 내리는 빗 속 우산에 내리는 빗 속 우산에 우리 내리는 빗 속 우산에 내리는 빗 속 우산에 우리 내리는 빗 속 우산에 내리는 빗 속 우산에 우리,우산이 두갠데,윤딴딴,우산이 두갠데,2014.09.15,"인디음악, 포크/블루스"
879,2274404,헤이 헤이  강물같은 노래를 품고 사는   사람은 알게되지 음 알게되지   내내 어두웠던 산들이   저녁이되면 왜 강으로 스미어   꿈을 꾸다 밤이 깊을수록   말없이 서로를 쓰다듬으며   부둥켜안은채 느긋하게   정들어 가는지를 으음 음  지독한 외로움에 쩔쩔매본   사람은 알게되지 음 알게되지   그슬픔에 굴하지 않고   비켜서지 않으며   어느결에 반짝이는 꽃눈을 닫고   우렁우렁 잎들을 키우는   사랑이야말로   짙푸른 숲이되고 산이되어   메아리로 남는다는 것을   누가 뭐래도 사람이   꽃보다 아름다워   이 모든 외로움 이겨낸   바로 그사람   누가 뭐래도 그대는   꽃보다 아름다워   노래의 온기를 품고사는   바로 그대 바로 당신   바로 우리 우린 참사랑   지독한 외로움에 쩔쩔매본   사람은 알게되지 음 알게되지   그슬픔에 굴하지 않고   비켜서지 않으며   어느결에 반짝이는   꽃눈을 닫고   우렁우렁 잎들을 키우는   사랑이야말로   짙푸른 숲이되고 산이되어   메아리로 남는다는 것을   누가 뭐래도 사람이   꽃보다 아름다워   이 모든 외로움 이겨낸   바로 그사람   누가 뭐래도 그대는   꽃보다 아름다워   노래의 온기를 품고사는   바로 그대 바로 당신   바로 우리 우린 참사랑  누가 뭐래도 사람이   꽃보다 아름다워  노래의 온기를 품고사는  바로 그대 바로 당신  바로 우리 우린 참사랑,사람이 꽃보다 아름다워,안치환,Desire,1997.12.12,포크/블루스
880,5493725,보일 듯 말 듯 가물거리는 안개 속에 쌓인 길  잡힐 듯 말 듯 멀어져가는  무지개와 같은 길  그 어디에서 날 기다리는지  둘러 보아도 찾을 수 없네  그대여 힘이 되주오  나에게 주어진 길  찾을 수 있도록  그대여 길을 터주오  가리워진 나의 길  이리로 가나 저리로 갈까  아득하기만 한데  이끌려 가듯  떠나는 이는  제 갈길을 찾았나  손을 흔들며 나 떠나 보낸 뒤  외로움만이 나를 감쌀 때  그대여 힘이 되주오  나에게 주어진 길 찾을 수 있도록  그대여 길을 터주오  가리워진 나의 길  그대여 힘이 되주오 나에게 주어진 길 찾을 수 있도록 그대여 길을 터주오 가리워진 나의 길,가리워진 길,볼빨간사춘기,미생 OST Part.4,2014.12.05,"포크/블루스, 국내드라마"
881,33387371,너를 사랑해 난 너와 행복해 우리 둘이 매일 love love love 사랑해 사랑해 너를 이렇게 너를 모든 순간이 행복해 너를 만나 많이 달라진 나 하루하루 힘들기만 했어 지쳐있는 내 맘 환하게 밝혀준 그대가 있어서 오 너를 사랑해 난 너와 행복해 우리 둘이 매일 love love love 사랑해 사랑해 너를 이렇게 너를 모든 순간이 행복해 너를 만나 많이 달라진 나 하루하루 힘들기만 했어 지쳐있는 내 맘 환하게 밝혀준 그대가 있어서 오 너를 사랑해 난 너와 행복해 우리 둘이 매일 love love love 사랑해 사랑해 너를 이렇게 너를 모든 순간이 행복해 All I need is your love 내 곁에 있어줘 난 정말 너말고 다른건 필요없어 매일이 새로워 삶의 이유 알았고 덕분에 세상 두렵지않아 I gotta go 진부할 수 있는 말이지만 사랑해 니가 원하는건 뭐든 가능해 나랑해 봄바람처럼 살며시 다가와준 너 잊지마 니 옆에는 내가 있다는 거 너를 사랑해 난 너와 행복해 우리 둘이 매일 love love love 사랑해 사랑해 너를 이렇게 너를 모든 순간이 행복해,모든 순간이 행복해,정민혁,불새2020 OST Part.16,2021.04.05,"포크/블루스, 국내드라마"
882,30079021,지금은 내 삶의 어디의 어디쯤일까 지금은 지금은 어디의 어떤 길을 걷고 있는 건지 걸어가다 보면 좋을 때도 있지만 집으로 돌아가는 길은 차갑기만 하네 그때 그 시절로 고백 떠나간 내 사랑이여 컴백 사랑이란 말로 충분한 어머니와 아버지가 계신 그곳에 감히 돌아가지 못하고 힘들다는 말도 못하고 잠깐 좋은 느낌 그 떨림 대체 무얼 위해 난 살아가는지 그때 그 시절로 고백 떠나간 내 사랑이여 컴백 사랑이란 말로 충분한 어머니와 아버지가 계신 그 곳에 감히 돌아가지 못하고 연락 한 번 하지 못하고 잠깐 좋은 느낌 그 떨림 그 어디쯤을 살아가는 나 어느새 시간은 가고 내려오던 눈은 녹아 흘러져 가 오 다시 꽃들은 피겠지 그래도 내 맘의 겨울엔 어느새 니가 돌아오지 않아 어느새 어느새 어느새 사랑하는 사람들은 모두 떠나고 집으로 돌아오는 길은 외롭기만 하네 그때 그 시절로 고백 떠나간 내 사랑이여 컴백 사랑이란 말로 충분한 어머니와 아버지가 계신 그곳에 감히 돌아가지 못하고 힘들다는 말도 못하고 잠깐 좋은 느낌 그 떨림 대체 무얼 위해 난 살아가는지 그때 그 시절로 고백 떠나간 내 사랑이여 컴백 웃음이란 말로 충분한 친구들과 추억들이 있는 그 곳에 감히 돌아가지 못하고 연락 한 번 하지 못하고 잠깐 좋은 느낌 그 떨림 그 어디쯤을 살아가는 나 나 나 이 다음에 커서 나는 나 나 이 다음에 커서 나는 나 나 이 다음에 커서 나는 뭐가 나 그때 그 시절로 고백 떠나간 내 사랑이여 컴백 사랑이란 말로 충분한 어머니와 아버지가 계신 그곳에 감히 돌아가지 못하고 힘들다는 말도 못하고 잠깐 좋은 느낌 그 떨림 그 어디쯤을 살아가는 나,27살의 고백,윤딴딴,27살의 고백,2016.11.06,"인디음악, 포크/블루스"
883,32594047,이제 난 아무 말 하고 있지 않아요 내 얘길 하는 것이 너무 지겨워 나는 그들과 같은 세상을 살고 있는데 마치 다른 세상에 사는 것처럼  나는 좋은 추억을 갖고 있어요 한때 정말 행복했던 것 같아요 눈앞에 쟤처럼 아니  그 애처럼 살고 싶어요 나는 내가 아닌 것 같아 샘을 내고 있진 않아요  샘이 좀 나긴 했지만 부러워하지는 않아요 서운하긴 했지만 아쉽다 말하라는 것 같아 미안하다 말하라는 것 같아 난 아냐 난 아냐 걘 요즘 어떻게 지낸대 혹은 누구랑 사귄대  나는 아무렇지 않아요 그냥 그저 살고 있어요 난 요즘 생각을 좀 한대 시끄러 나 살기에도 바쁜데 내가 불행하길 바란 건지 날 생각해서 하는 말인지 나는 그들과 같은 세상을 살고 있는데 샘을 내고 있진 않아요  샘이 좀 나긴 했지만 부러워하지는 않아요 서운하긴 했지만 아쉽다 말하라는 것 같아 미안하다 말하라는 것 같아 샘을 내고 있지 않아요 부러워하지도 않아요 아쉽다 말하라는 것 같아 미안하다 말하라는 것 같아 난 아냐 난 아냐 난 아냐 난 아냐,카운슬링,볼빨간사춘기,사춘기집Ⅱ 꽃 본 나비,2020.05.13,"인디음악, 포크/블루스"
884,32404627,마음 가득 따듯한 사람이 되고파요 이렇게 놀라운 생각이 문득 떠오를 때 내 많은 사람 곁에 있어 고맙다고 말하지 못하고 지나쳐가니 속상해도 모닥불에 함께 비춰 우리 모든 바람이 불어도 한 사람이 된 것처럼 내가 너무 행복해 돌아올 때 두 손 내밀어 웃어주렴 보잘것없이 그 무엇이든 좋으니 밝고 힘있게 웃어주렴 난 가끔 불편한 사람들도 울적으로 지나쳐 감춰지기를 바랐었고 너는 내가 그리도 반가운지 곱게 미소 지었어 모닥불에 함께 비춰 우리 모든 바람이 불어도 한 사람이 된 것처럼 내가 너무 행복해 돌아올 때 두 손 내밀어 웃어주렴 보잘것없이 그 무엇이든 좋으니 밝고 힘있게 웃어주렴 내가 너무 행복해 돌아올 때 두 손 내밀어 웃어주렴 보잘것없이 그 무엇이든 좋으니 밝고 힘있게 웃어주렴 밝고 힘있게 웃어주렴,모닥불,최유리,동그라미,2020.02.24,"인디음악, 포크/블루스"
885,2656351,갈라진 창문 틈새에 스민 이상하리만치 따스한 그 겨울 밤 별빛을 아직 기억해 차가운 여관방 이불 속에 부끄러운 사랑의 자욱 하늘을 날았던 몸짓을 기억해 기억해 별이 쏟아진 다리 우리 야윈 손을 꼭 잡고 걸어가던 길을 걷다 마주한 가장 아름다운 순간에 바라보던 그 달 그 밤 그때에 나를 담은 작은 그림들이 지난 낭만의 꿈속에 어른이 된 나는 어지러워  새벽을 맞은 동네 골목에 이상하리만치 달콤한 자판기 커피 냄샐 아직 기억해 먼지에 가려진 빙판길에 어쩔 줄 모르던 고양이 그 살가운 울음소리를 기억해 기억해 별이 쏟아진 다리 우리 야윈 손을 천천히 놓아가며 길을 걷다 마주한 가장 안타까운 순간에 바라보던 그 달 그 밤 그때에 나를 담은 작은 그림들이 지난 낭만의 꿈속에 어른이 된 나는 어지러워 지나간 지난 얘기 지난 그림 어렴풋한 사랑의 장면 낭만의 꿈속 애매한 느낌 아련한 연기와 나 메마른 아침에 눈을 뜨면 안타까운 가장 아름다운 저 풍경에 더 아쉬운 귓가에 맴도는 목소리에 더 그리운 가장 아름다운 그 순간에 더 두려운 별이 쏟아진 다리 우리 야윈 손을 천천히 놓아가네 어려운 일이지만 가장 아름다운 순간에 바라보던 그 달 그 밤 그때에 나를 담은 작은 그림들이 지난 낭만의 꿈속에 어른이 된 나는 어지러워 그 달 그 밤 나를 담은 작은 그림들이 지난 낭만의 꿈속에 어른이 된 나는 어지러워  어른이 된 나는 어지러워,새벽 4시,10CM,10cm The First EP,2010.04.22,"인디음악, 포크/블루스"
886,31070272,알람이 울리고도 한참이 지나도록 늦잠을 잤을 때 또 지각일까 걱정을 했지만 주말일 때 잡힌 약속도 없고 딱히 할 일도 없어 버스를 탔을 때 내 옆자리에 앉게 된 사람이 바로 너였을 때 행복한걸 행복한 걸 어제와 똑같은 하루지만 오늘 하루가 왠지 조금 행복하게 느껴지는 건 because of you because of you 이런 내 맘을 모르겠지만 잠깐이라도 잔잔하게 미소 짓게 만드는 순간 그건 너 때문인 걸 평소 안 쓰던 일기를 다 쓰네 널 생각하며 잘 안 치던 기타를 다치네 평소랑 다른 시간 생각도 못했지만 너와 마주칠 때 많은 사람들 속에서 우리만 서로 느껴질 때 행복한걸 행복한 걸 어제와 똑같은 하루지만 오늘 하루가 왠지 조금 행복하게 느껴지는 건 because of you because of you 이런 내 맘을 모르겠지만 잠깐이라도 잔잔하게 미소 짓게 만드는 순간 그건 너 때문인 걸 행복한걸 행복한 걸 너의 얼굴을 떠올릴 때면 내일 하루가 오늘보다 행복해질 것만 같은 걸 Only for you baby only for you 이런 내 맘을 모르겠지만 잠깐이라도 잔잔하게 미소 짓게 만드는 순간 너에게 주고 싶어 다시 불을 켜 자꾸만 가슴이 두근거려서 손 글씨를 연습해 몇 번씩 네 이름을 써 네 이름을 화분에 붙일게 물을 줄 때면 곧 사랑이 시작될 것 같애,소확행,스탠딩 에그,소확행,2018.05.11,"인디음악, 포크/블루스"
887,33393819,짙은 어둠이 우릴 삼켜도 거센 바람이 널 흔든대도 우린 저 밤하늘 별빛처럼 새벽 이슬 품은 풀꽃처럼 피어나 피어나 그 어떤 모습이라 해도 좋아 긴 밤 지새운 눈물들이 고운 이슬 되어 맺히면 우린 꿈꾸는 아이처럼 아직 설레는 눈빛 속에 피어나 피어나 그 어떤 모습이라도 피어나 피어나 그 모든 네 모습 그대로 좋아,피어나,이인세 (INSE),피어나,2021.04.07,"인디음악, 포크/블루스"
